[
  {
    "schemaVersion": "1.0.0",
    "id": "core.log",
    "namespace": "core",
    "name": "log",
    "version": "1.0.0",
    "runtime": {
      "target": "python",
      "module": "rpa_runtime.blocks.core",
      "callable": "log",
      "mode": "sync"
    },
    "inputs": [
      {
        "name": "message",
        "type": {
          "name": "string"
        }
      }
    ]
  },
  {
    "schemaVersion": "1.0.0",
    "id": "system.get_os_info",
    "namespace": "system",
    "name": "get_os_info",
    "version": "1.0.0",
    "runtime": {
      "target": "python",
      "module": "rpa_runtime.blocks.system",
      "callable": "get_os_info",
      "mode": "sync"
    },
    "outputs": [
      {
        "name": "name",
        "type": {
          "name": "string"
        }
      }
    ]
  }
]
